{
  "$schema": "https://json-schema.org/draft/2020-12/schema", "$id": "https://example.invalid/global-province-map/polity-gazetteer.schema.json", "title": "M24 Polity and Dependency Gazetteer", "type": "object",
  "required": ["schema_version", "document_type", "artifact_version", "pass_id", "start_date", "polities"],
  "properties": {"schema_version": {"enum": ["0.1.0", "0.2.0", "0.3.0", "0.4.0"]}, "document_type": {"const": "polity_gazetteer"}, "artifact_version": {"type": "string", "minLength": 1}, "pass_id": {"type": "string", "minLength": 1}, "start_date": {"type": "string", "format": "date"},
    "polities": {"type": "array", "minItems": 1, "items": {"type": "object", "required": ["polity_id", "name", "aliases", "valid_from", "valid_to", "capital_location_ids", "relationships", "source_ids"], "properties": {
      "polity_id": {"type": "string", "minLength": 1}, "name": {"type": "string", "minLength": 1}, "actor_kind": {"enum": ["state", "polity", "chiefdom", "city_network", "community", "mobile_community", "external_claimant", "other", "unknown"]}, "territory_component_ids": {"$ref": "#/$defs/strings"}, "aliases": {"$ref": "#/$defs/strings"}, "valid_from": {"$ref": "#/$defs/dateish"}, "valid_to": {"$ref": "#/$defs/dateish"}, "capital_location_ids": {"$ref": "#/$defs/strings"}, "source_ids": {"$ref": "#/$defs/strings"},
      "relationships": {"type": "array", "items": {"type": "object", "required": ["relationship_id", "type", "target_polity_id", "valid_from", "valid_to", "source_ids", "confidence", "notes"], "properties": {"relationship_id": {"type": "string", "minLength": 1}, "type": {"enum": ["sovereignty", "control", "occupation", "vassalage", "dependency", "personal_union", "claim", "disputed"]}, "target_polity_id": {"type": "string", "minLength": 1}, "valid_from": {"$ref": "#/$defs/dateish"}, "valid_to": {"$ref": "#/$defs/dateish"}, "source_ids": {"$ref": "#/$defs/nonemptyStrings"}, "confidence": {"type": "string", "minLength": 1}, "notes": {"type": "string", "minLength": 1}}, "additionalProperties": false}}
    }, "additionalProperties": false}}
  }, "allOf": [{"if": {"properties": {"schema_version": {"const": "0.4.0"}}, "required": ["schema_version"]}, "then": {"properties": {"polities": {"items": {"required": ["actor_kind", "territory_component_ids"]}}}}}], "$defs": {"strings": {"type": "array", "uniqueItems": true, "items": {"type": "string", "minLength": 1}}, "nonemptyStrings": {"type": "array", "minItems": 1, "uniqueItems": true, "items": {"type": "string", "minLength": 1}}, "dateish": {"type": ["string", "null"], "pattern": "^[0-9]{4}(-[0-9]{2}(-[0-9]{2})?)?$"}}, "additionalProperties": false
}
